{
  "schema_version": "epiphany-harness.ir.v1",
  "dialect": "native",
  "skill_name": "epiphany-executor",
  "skill_version": "1.0.0",
  "determinism_class": "non-deterministic",
  "nodes": {
    "read_plan": {
      "id": "read_plan",
      "name": "read_plan",
      "type": "io",
      "tier": "no-llm",
      "exec_type": "inline",
      "hat": "",
      "inputs": [
        {
          "name": "plan_path",
          "required": false,
          "signal_field": "plan_path"
        }
      ],
      "outputs": [
        {
          "name": "plan_raw",
          "signal_field": "plan_raw"
        }
      ],
      "raises_signals": [],
      "module_file": "modules/N-read_plan.md",
      "ensemble": null,
      "hitl": false,
      "scale_gates": {},
      "join_policy": null,
      "aggregation_policy": null,
      "required_output_sections": [],
      "conditional": false,
      "wave": null,
      "downshiftable": false,
      "rationale": "",
      "tool_call": {
        "tool": "fs.read_text",
        "args": {
          "path": "plan_path"
        },
        "outputs": {
          "plan_raw": "content"
        }
      }
    },
    "ingest_plan": {
      "id": "ingest_plan",
      "name": "ingest_plan",
      "type": "io",
      "tier": "no-llm",
      "exec_type": "inline",
      "hat": "",
      "inputs": [
        {
          "name": "plan_raw",
          "signal_field": "plan_raw"
        }
      ],
      "outputs": [
        {
          "name": "normalized_plan",
          "signal_field": "normalized_plan"
        },
        {
          "name": "plan_metadata",
          "signal_field": "plan_metadata"
        }
      ],
      "raises_signals": [],
      "module_file": "modules/N-ingest_plan.md",
      "ensemble": null,
      "hitl": false,
      "scale_gates": {},
      "join_policy": null,
      "aggregation_policy": null,
      "required_output_sections": [],
      "conditional": false,
      "wave": null,
      "downshiftable": false,
      "rationale": "",
      "tool_call": {
        "tool": "plan.normalize_md",
        "args": {
          "plan_raw": "plan_raw"
        },
        "outputs": {
          "normalized_plan": "normalized_plan",
          "plan_metadata": "plan_metadata"
        }
      }
    },
    "honor_gates": {
      "id": "honor_gates",
      "name": "honor_gates",
      "type": "llm",
      "tier": "model-medium",
      "exec_type": "inline",
      "hat": "",
      "inputs": [
        {
          "name": "normalized_plan",
          "signal_field": "normalized_plan"
        },
        {
          "name": "plan_metadata",
          "signal_field": "plan_metadata"
        }
      ],
      "outputs": [
        {
          "name": "gate_decision",
          "signal_field": "gate_decision"
        }
      ],
      "raises_signals": [],
      "module_file": "modules/N-honor_gates.md",
      "ensemble": null,
      "hitl": false,
      "scale_gates": {},
      "join_policy": null,
      "aggregation_policy": null,
      "required_output_sections": [],
      "conditional": false,
      "wave": null,
      "downshiftable": false,
      "rationale": ""
    },
    "build_context": {
      "id": "build_context",
      "name": "build_context",
      "type": "llm",
      "tier": "model-medium",
      "exec_type": "inline",
      "hat": "",
      "inputs": [
        {
          "name": "normalized_plan",
          "signal_field": "normalized_plan"
        },
        {
          "name": "gate_decision",
          "signal_field": "gate_decision"
        },
        {
          "name": "ledger_state",
          "signal_field": "ledger_state"
        }
      ],
      "outputs": [
        {
          "name": "step_context",
          "signal_field": "step_context"
        },
        {
          "name": "look_ahead",
          "signal_field": "look_ahead"
        }
      ],
      "raises_signals": [],
      "module_file": "modules/N-build_context.md",
      "ensemble": null,
      "hitl": false,
      "scale_gates": {},
      "join_policy": null,
      "aggregation_policy": null,
      "required_output_sections": [],
      "conditional": false,
      "wave": null,
      "downshiftable": false,
      "rationale": ""
    },
    "schedule_steps": {
      "id": "schedule_steps",
      "name": "schedule_steps",
      "type": "llm",
      "tier": "model-medium",
      "exec_type": "inline",
      "hat": "",
      "inputs": [
        {
          "name": "normalized_plan",
          "signal_field": "normalized_plan"
        },
        {
          "name": "step_context",
          "signal_field": "step_context"
        }
      ],
      "outputs": [
        {
          "name": "schedule",
          "signal_field": "schedule"
        },
        {
          "name": "next_step",
          "signal_field": "next_step"
        },
        {
          "name": "schedule_status",
          "port": "schedule_status",
          "signal_field": "schedule_status",
          "type": "any",
          "required": true
        }
      ],
      "raises_signals": [],
      "module_file": "modules/N-schedule_steps.md",
      "ensemble": null,
      "hitl": false,
      "scale_gates": {},
      "join_policy": null,
      "aggregation_policy": null,
      "required_output_sections": [],
      "conditional": false,
      "wave": null,
      "downshiftable": false,
      "rationale": ""
    },
    "execute_step": {
      "id": "execute_step",
      "name": "execute_step",
      "type": "llm",
      "tier": "model-medium",
      "exec_type": "inline",
      "hat": "",
      "inputs": [
        {
          "name": "next_step",
          "signal_field": "next_step"
        },
        {
          "name": "step_context",
          "signal_field": "step_context"
        }
      ],
      "outputs": [
        {
          "name": "step_effects",
          "signal_field": "step_effects"
        },
        {
          "name": "effect_records",
          "signal_field": "effect_records"
        }
      ],
      "raises_signals": [],
      "module_file": "modules/N-execute_step.md",
      "ensemble": null,
      "hitl": false,
      "scale_gates": {},
      "join_policy": null,
      "aggregation_policy": null,
      "required_output_sections": [],
      "conditional": false,
      "wave": null,
      "downshiftable": false,
      "rationale": ""
    },
    "precommit_gate": {
      "id": "precommit_gate",
      "name": "precommit_gate",
      "type": "llm",
      "tier": "model-medium",
      "exec_type": "inline",
      "hat": "",
      "inputs": [
        {
          "name": "step_effects",
          "signal_field": "step_effects"
        },
        {
          "name": "effect_records",
          "signal_field": "effect_records"
        }
      ],
      "outputs": [
        {
          "name": "precommit_approval",
          "signal_field": "precommit_approval"
        },
        {
          "name": "needs_human",
          "port": "needs_human",
          "signal_field": "needs_human",
          "type": "any",
          "required": true
        }
      ],
      "raises_signals": [],
      "module_file": "modules/N-precommit_gate.md",
      "ensemble": null,
      "hitl": false,
      "scale_gates": {},
      "join_policy": null,
      "aggregation_policy": null,
      "required_output_sections": [],
      "conditional": false,
      "wave": null,
      "downshiftable": false,
      "rationale": ""
    },
    "verify_dod": {
      "id": "verify_dod",
      "name": "verify_dod",
      "type": "llm",
      "tier": "model-medium",
      "exec_type": "inline",
      "hat": "",
      "inputs": [
        {
          "name": "next_step",
          "signal_field": "next_step"
        },
        {
          "name": "step_effects",
          "signal_field": "step_effects"
        },
        {
          "name": "precommit_approval",
          "signal_field": "precommit_approval"
        }
      ],
      "outputs": [
        {
          "name": "dod_verdict",
          "signal_field": "dod_verdict"
        }
      ],
      "raises_signals": [],
      "module_file": "modules/N-verify_dod.md",
      "ensemble": null,
      "hitl": false,
      "scale_gates": {},
      "join_policy": null,
      "aggregation_policy": null,
      "required_output_sections": [],
      "conditional": false,
      "wave": null,
      "downshiftable": false,
      "rationale": ""
    },
    "post_step_review": {
      "id": "post_step_review",
      "name": "post_step_review",
      "type": "llm",
      "tier": "model-medium",
      "exec_type": "inline",
      "hat": "",
      "inputs": [
        {
          "name": "dod_verdict",
          "signal_field": "dod_verdict"
        },
        {
          "name": "step_effects",
          "signal_field": "step_effects"
        }
      ],
      "outputs": [
        {
          "name": "state_delta",
          "signal_field": "state_delta"
        },
        {
          "name": "look_ahead",
          "signal_field": "look_ahead"
        }
      ],
      "raises_signals": [],
      "module_file": "modules/N-post_step_review.md",
      "ensemble": null,
      "hitl": false,
      "scale_gates": {},
      "join_policy": null,
      "aggregation_policy": null,
      "required_output_sections": [],
      "conditional": false,
      "wave": null,
      "downshiftable": false,
      "rationale": ""
    },
    "checkpoint_route": {
      "id": "checkpoint_route",
      "name": "checkpoint_route",
      "type": "llm",
      "tier": "model-medium",
      "exec_type": "inline",
      "hat": "",
      "inputs": [
        {
          "name": "state_delta",
          "signal_field": "state_delta"
        },
        {
          "name": "dod_verdict",
          "signal_field": "dod_verdict"
        }
      ],
      "outputs": [
        {
          "name": "ledger_state",
          "signal_field": "ledger_state"
        },
        {
          "name": "lifecycle_status",
          "signal_field": "lifecycle_status"
        }
      ],